{"$schema":"https://json-schema.org/draft/2020-12/schema","$id":"jem-projection.schema.json","title":"jem-projection","type":"object","additionalProperties":false,"required":["schema_version","canonical_identity_value","adapter_version","structured_fields","product_specs","field_evidence","issues","ready","fingerprint"],"properties":{"schema_version":{"const":"2.0.0"},"canonical_identity_value":{"type":"string","pattern":"^canonical-identity-v1:sha256:[0-9a-f]{64}$"},"adapter_version":{"const":"normalized-to-jem-v1"},"structured_fields":{"type":"object","additionalProperties":false,"properties":{"name":{},"model":{},"slug":{},"product_type":{},"working_height_m":{"type":["string","null"]},"maximum_load_capacity_kg":{"type":["string","null"]},"machine_weight_kg":{"type":["string","null"]},"power_source":{"type":["string","null"]},"terrain_type":{"type":["string","null"]},"year":{"type":["string","null"]},"hours_meter":{"type":["string","null"]}}},"product_specs":{"type":"array","items":{"type":"object","additionalProperties":false,"required":["key","value","unit","order"],"properties":{"key":{"type":"string"},"value":{},"unit":{"type":["string","null"]},"order":{"type":"integer"}}}},"field_evidence":{"type":"array","items":{"type":"object","required":["source_field","target_field","value","observation_reference","provenance","adapter_version"]}},"issues":{"type":"array"},"ready":{"const":true},"fingerprint":{"type":"string","pattern":"^[0-9a-f]{64}$"}}}
