{"schema_version":"2.0.0","canonical_identity_value":"canonical-identity-v1:sha256:0000000000000000000000000000000000000000000000000000000000000000","adapter_version":"normalized-to-jem-v1","structured_fields":{"name":"Synthetic lift","working_height_m":"0"},"product_specs":[],"field_evidence":[],"issues":[],"ready":true,"fingerprint":"aaaaaaaaaaaaaaaaaaaaaaaaaaaaaaaaaaaaaaaaaaaaaaaaaaaaaaaaaaaaaaaa"}
